<?xml version="1.0" encoding="UTF-8" ?>
<project xmlns="http://www.kiv.zcu.cz/component-testing/player"
	xmlns:xsi="http://www.w3.org/2001/XMLSchema-instance"
	xsi:schemaLocation="http://www.kiv.zcu.cz/component-testing/player https://raw.github.com/michalriha/kivComponentTesting/extract_common_datatypes/UniPlayerBindings/schema/uniplayer.xsd">
	<settings>
		<time-limit>75600</time-limit>
		<simul-step-delay>500</simul-step-delay>
	</settings>
	<actions xmlns:types="http://www.kiv.zcu.cz/component-testing/types"
		xmlns:xsit="http://www.w3.org/2001/XMLSchema-instance"
		xsit:schemaLocation="http://www.kiv.zcu.cz/component-testing/types https://raw.github.com/michalriha/kivComponentTesting/extract_common_datatypes/CommonTypes/schema/types.xsd">
		<action time="100">
			<recurrence count="15">
				<equidistant step="100" />
			</recurrence>
			<command>
				<event topic="changeSourceDir" key="dir">
					<argument>
						<types:String>d:/Obr√°zky/</types:String>
					</argument>
				</event>
			</command>
		</action>
		<action time="150">
			<recurrence count="15" repeat-until="9223372036854775807">
				<exponential rate="5" time-span="3600" />
			</recurrence>
			<command>
				<event topic="changeDestinationDir" key="dir">
					<argument>
						<types:String>e:/</types:String>
					</argument>
				</event>
			</command>
		</action>
		<action time="200">
			<recurrence count="2">
				<equidistant step="100" />
			</recurrence>
			<command>
				<event topic="changeDestinationDir" key="dir">
					<argument>
						<types:String>d:/Videa/</types:String>
					</argument>
				</event>
			</command>
		</action>
	</actions>
</project>
